Account,id,createdAt,favorites,retweets,text
Saarang- IIT Madras,628593254666141696,2015-08-04 15:48:05+00:00,10,8,"He took a deep breath, ""This is it"", he thought, A gunshot.  Seconds later, he was  World sprint Champion.  #terriblytinytuesday #Saarang"
Saarang- IIT Madras,628524920234840064,2015-08-04 11:16:33+00:00,6,3,"Kishore Kumar's melodies are treasured even today. 'Pal Pal Dil ke paas', he'll always touch our hearts. Happy Birthday! #Saarang"
Saarang- IIT Madras,628173174111232000,2015-08-03 11:58:50+00:00,6,5,What goes best with a cup of coffee? Another cup!  #MadEyeMonday #Saarang
Saarang- IIT Madras,627857481897635840,2015-08-02 15:04:23+00:00,8,6,"“A friend is someone who knows the song in your heart, and can sing it back to you when you have forgotten the words.” #TagAfriend #Saarang"
Saarang- IIT Madras,627522883997204480,2015-08-01 16:54:49+00:00,6,4,Lake Sørvágsvatn in Faroe Islands stands 30 metres high to Atlantic Ocean #SaarangTravels #SizzlingSaturday #Saarang http://t.co/l2yOFBB94q
Saarang- IIT Madras,627495526347374592,2015-08-01 15:06:06+00:00,5,2,Commanding the midfield for 13 years. Happy 31 @BSchweinsteiger  #Saarang http://t.co/ZbaVRzSOFA
Saarang- IIT Madras,627463014577377280,2015-08-01 12:56:55+00:00,6,6,A day on Jupiter's moon lasts less than 5 hrs. Just like Saturday on Earth. #SizzlingSaturday #Saarang
Saarang- IIT Madras,627121585564979200,2015-07-31 14:20:12+00:00,6,4,Thought this week was scary and tough?Head over to theater to meet your week's competition. #VaticanTapes #Southpaw #BhejaFryday #Saarang
Saarang- IIT Madras,627081139526578176,2015-07-31 11:39:28+00:00,6,4,#HarryPotter geeks would mark the day they got their icon and creator. #HappyBirthdayJKRowling #BhejaFryday #Saarang http://t.co/lGdTsod90N
Saarang- IIT Madras,627000882081562624,2015-07-31 06:20:34+00:00,7,6,Guru is next to God. #Saarang wishes a heartfelt #GuruPurnima to all the GURU's for touching and enlightening innumerable minds!
Saarang- IIT Madras,626800431646142464,2015-07-30 17:04:02+00:00,5,4,Neville Longbottom is an iconic character in #HarryPotter. 35 years old now! Happy Birthday Neville! @Mattdavelewis #Saarang #Thorsday
Saarang- IIT Madras,626764495080157184,2015-07-30 14:41:15+00:00,7,4,"Happy Birthday Phoebe, The Terminator and Christopher Nolan! Epic people, same birthday! @LisaKudrow @Schwarzenegger  #Saarang #Thorsday"
Saarang- IIT Madras,626744466909466624,2015-07-30 13:21:39+00:00,6,3,Whistleblower Sanjiv Chaturvedi and activist Anshu Gupta among the 5 to win #Magsaysay award. Congratulations! #Saarang #Thorsday
Saarang- IIT Madras,626657813071204352,2015-07-30 07:37:20+00:00,9,6,Happy Birthday @sonunigam! @Saarang_IITM is proud to have associated with such a musical genius. #Saarang http://t.co/u9IyRUBPwk
Saarang- IIT Madras,626433570190462976,2015-07-29 16:46:16+00:00,3,3,"Tyger Tyger burning bright. But in 2050, tales will speak of animals with orange pride. Save the tiger. #WickedWednesdays #Saarang #TigerDay"
Saarang- IIT Madras,626423154252984320,2015-07-29 16:04:53+00:00,6,6,"UN declares #KalamSir 's Birthday, 15th October as World Students' Day. #APJAbdulKalam #Saarang"
Saarang- IIT Madras,626407272374120449,2015-07-29 15:01:46+00:00,7,6,"EDM in India just shot up to a whole new level. Brace yourselves people, @Skrillex is touring India this October! #WickedWednesdays #Saarang"
Saarang- IIT Madras,625951721215254528,2015-07-28 08:51:34+00:00,9,7,Failure will never overtake me if my definition to succeed is strong enough. #quotes #KalamSir #Saarang
Saarang- IIT Madras,625948606487343105,2015-07-28 08:39:12+00:00,8,7,"If you want to shine like a Sun, first burn like a Sun. #quotes #KalamSir #Saarang"
Saarang- IIT Madras,625926133062635522,2015-07-28 07:09:53+00:00,9,9,"You know you have done your job when a whole nation laments your death. For Dr Kalam, the effect is just quantified. #KalamSir #Saarang"
Saarang- IIT Madras,625698892294688768,2015-07-27 16:06:55+00:00,10,9,"Dr.Kalam, for all those lives you've touched and inspired, you'll always remain in our hearts! #RIPKalam #MissileMan #Saarang"
Saarang- IIT Madras,625672040867979265,2015-07-27 14:20:13+00:00,6,4,Wow! Bugs has been with us last 75 years. The best cartoons ever @WarnerBrosEnt  #bugsbunny #looneytoons #Saarang http://t.co/ReevD0nJSF
Saarang- IIT Madras,625631265480273921,2015-07-27 11:38:12+00:00,6,5,Reminisce. @Calvinn_Hobbes  #CalvinAndHobbes #Saarang #MadEyeMonday http://t.co/47VLnY94AF
Saarang- IIT Madras,625337519358382080,2015-07-26 16:10:57+00:00,6,3,"Chocolate.... All @ChocolateIovers, this is something you can't miss in Chennai! http://t.co/ubw4ePBxR2 #ThandeySundae #Saarang"
Saarang- IIT Madras,625297328425996289,2015-07-26 13:31:15+00:00,12,5,"Graduating class of 2015, All the best for the exciting times ahead. @Saarang_IITM will miss you! #Saarang http://t.co/SqFeO8S1Mr"
Saarang- IIT Madras,624985953707253764,2015-07-25 16:53:57+00:00,8,8,On the 16th anniversary of Kargil war let us salute all those soldiers who risk everything to save us! Jai Hind! #KargilVijayDiwas #Saarang
Saarang- IIT Madras,624939189126049792,2015-07-25 13:48:08+00:00,7,4,"How sizzling can be your ""tomorrow""? Better than @TomorrowLand? See for yourself maybe? #TomorrowlandLIVE #SizzlingSaturday #Saarang"
Saarang- IIT Madras,624883195297689600,2015-07-25 10:05:38+00:00,11,4,Happy Birthday #MattLeBlanc. Maybe today is a good day to share food? @HookedonFriends #JoeyTribbiani #Saarang http://t.co/OMXONr2sfj
Saarang- IIT Madras,624618303990820864,2015-07-24 16:33:03+00:00,9,3,"Grab your magnifying glasses and head to theaters!!Whether it is Ant-Man or Mr. Holmes, get ready to let your hair down. #BhejaFryday"
Saarang- IIT Madras,624564102648561664,2015-07-24 12:57:40+00:00,8,5,Ever wondered if there exists another 'you'? You could be just right. @NASA finds Earth's bigger twin. #Kepler452 #NASABeyond #Saarang
Saarang- IIT Madras,624240438346579968,2015-07-23 15:31:32+00:00,6,4,Ain't it grand to be the Chosen One? Happy Bday to the Boy Who Lived! #HappyBirthdayDanielRadcliffe #Thorsday #Saarang
Saarang- IIT Madras,624189946966863872,2015-07-23 12:10:54+00:00,6,4,#CaptainVyom still has it in him! Congrats @milindrunning for completing one of the toughest triathlons! #SwiftyFifty #Thorsday #Saarang
Saarang- IIT Madras,611920746063921152,2015-06-19 15:37:29+00:00,2,2,Indian Hockey Men's and Women's team qualify for the Hockey World League-Semifinals. Starting 20 june. #Cheerourheros #HWL2015 #Saarang
Saarang- IIT Madras,611919665053351936,2015-06-19 15:33:11+00:00,2,1,Its time to go #IndiaaIndia with adrenaline gushing. All the Best @TheHockeyIndia. #DeshKeLiye #BharatKiShaan #HWL2015 #Saarang
Saarang- IIT Madras,611918787722391552,2015-06-19 15:29:42+00:00,3,2,Congratulating @TheHockeyIndia for making it to the semis. #HWL2015 #RoadToRio #Deshkeliye   #Saarang  https://t.co/PDnjWpenhw
Saarang- IIT Madras,607101979404304384,2015-06-06 08:29:25+00:00,8,4,The black buck in its natural environment #GreenIITM #IITM #Saarang http://t.co/zRF7PIvhdw
Saarang- IIT Madras,607101527606501376,2015-06-06 08:27:38+00:00,7,2,"The elusive albino black buck, only one of two at #GreenIITM #IITM #Saarang http://t.co/2dsBdmJ6h8"
Saarang- IIT Madras,607101236316217344,2015-06-06 08:26:28+00:00,7,5,"Our famous Gajendra Circle, or GC as we call it, shining in the night. #GreenIITM #IITM #Saarang http://t.co/lQiHQhZp1R"
Saarang- IIT Madras,607100401377116160,2015-06-06 08:23:09+00:00,4,1,"The milkweed bug, scaring students away by creating a confusingly long chain of red &amp; black #GreenIITM #IITM #Saarang http://t.co/cgInvBLhQg"
Saarang- IIT Madras,607097746944720896,2015-06-06 08:12:36+00:00,7,8,Catching a few winks in our hostel wings #GreenIITM #IITM #Saarang http://t.co/TEIXDzbd3Y
Saarang- IIT Madras,607096933400768513,2015-06-06 08:09:22+00:00,6,6,The majestic horns of the black buck. #GreenIITM #IITM #Saarang http://t.co/Ruf4sDgDbO
Saarang- IIT Madras,607096284508352512,2015-06-06 08:06:48+00:00,7,7,An amazing pic of a mother with its baby monkey #GreenIITM #IITM #Saarang http://t.co/LKBjxhjBec
Saarang- IIT Madras,607095878667530241,2015-06-06 08:05:11+00:00,4,1,Deer are definitely not a rarity in #GreenIITM #IITM #Saarang http://t.co/nvBE7F21q7
Saarang- IIT Madras,607095366710796288,2015-06-06 08:03:09+00:00,6,5,"The spotted deer, chilling around  #IITM #GreenIITM #Saarang http://t.co/iOMUGKwE0C"
Saarang- IIT Madras,607093115837480960,2015-06-06 07:54:12+00:00,1,1,"Celebrating World Environment Day by showcasing our IIT Madras campus' vibrant natural connect, in its glorious flora &amp; fauna #IITM #Saarang"
Saarang- IIT Madras,554236444076953600,2015-01-11 11:20:40+00:00,7,1,Welcome to Saarang and IIT Madras @SunidhiChauhan5  #Saarang2015
Saarang- IIT Madras,554215384773980163,2015-01-11 09:56:59+00:00,1,0,Design T-shirt on your own.  Your art your shirt.  At T-shirt painting workshop now at CRC. @Saarang_IITM
Saarang- IIT Madras,553065056548556800,2015-01-08 05:45:59+00:00,1,0,Apart from the insane fun! Saarang puts your mettle to test! Quizzing @Saarang_IITM @CRC IIT MADRAS
Saarang- IIT Madras,553064087504961537,2015-01-08 05:42:08+00:00,1,0,Want to have a new friend and dance with him/her. Here is the chance. @SAC #Salsaworkshop  #Saarang #NextBigBang
Saarang- IIT Madras,552712126402289665,2015-01-07 06:23:34+00:00,1,1,The prerequisite to fight something is to know about it. #TogetherWeWill Date: 9 Jan 2015 Time : 11 am
Saarang- IIT Madras,552711917391736833,2015-01-07 06:22:44+00:00,3,3,"Saarang Eunoia, in association with the Apollo Speciality Hospital, is organising a Cancer Awareness Conclave. http://t.co/1s5tL2uUkK"
Saarang- IIT Madras,552711562528444416,2015-01-07 06:21:20+00:00,2,0,"For more details, please visit: http://t.co/AwhfRiQr8S http://t.co/HNONsCbTdt #NextBigBang #Saarang2015 http://t.co/XPFMQJyI3r"
Saarang- IIT Madras,552711317706915842,2015-01-07 06:20:21+00:00,1,0,"Win an exciting recording opportunity and a summer school attendance at two of Saarang's most serene music events, Acoustyx and Acapella."
Saarang- IIT Madras,552710742256783361,2015-01-07 06:18:04+00:00,3,1,"SAARANG 2015 presents to you On-Site Creative Writing. Battle in the real word war, a fight till the ink dies! http://t.co/xthc6oujpM"
Saarang- IIT Madras,552710094950248450,2015-01-07 06:15:30+00:00,1,0,"Woo the crowd with the magic of pure vocals at our very own Raagapella, the light music acapella singing event. http://t.co/VmXdK3tT07"
Saarang- IIT Madras,552709814355501056,2015-01-07 06:14:23+00:00,2,1,Saarang presents to you the MRF stunt show at the KV ground. Be there to experience the adrenaline rush. #Saarang2015 http://t.co/aYvqfZvcwl
Saarang- IIT Madras,552709381503352832,2015-01-07 06:12:40+00:00,0,0,"Get live hands in a session on Autospark Design using a specially designed kit at the Autospark workshop, Saarang 2015. #Saarang2015"
Saarang- IIT Madras,552709178348032000,2015-01-07 06:11:51+00:00,2,0,Auto spark is a national level tech workshop cum championship in association with Robosejugous Technologies pvt. Ltd. http://t.co/7iHZBN6FLs
Saarang- IIT Madras,552708799862419456,2015-01-07 06:10:21+00:00,1,0,Witness fierce moves this year at Saarang Informals. It is the #nextBigBang. #Saarang2015 http://t.co/IovRORSmts
Saarang- IIT Madras,552708473289707520,2015-01-07 06:09:03+00:00,2,1,"Come over to the Informals zone on Jan 10th in Saarang, IIT Madras to watch Team 8e perform amazing stunts and tricks."
Saarang- IIT Madras,552708047098109952,2015-01-07 06:07:21+00:00,2,2,"Karnivool will perform at Saarang, IIT Madras on 10th January 2015. Tickets available at http://t.co/4p2PixOylX http://t.co/5NIj8llpFn"
Saarang- IIT Madras,552004657061834752,2015-01-05 07:32:20+00:00,6,7,"Witness 8 acts form 7 countries, spread across 4 days at the SAC and carnival stage, IIT Madras. #Saarang2015 http://t.co/qMzhcB845b"
Saarang- IIT Madras,552004264709869568,2015-01-05 07:30:47+00:00,0,0,"Have you ever wanted to experience the world around you? The Saarang World Fest makes it a lot easier, bringing international entertainment."
Saarang- IIT Madras,552000519330627584,2015-01-05 07:15:54+00:00,2,0,"It is through this ‘man-made’ art, called Cinema that we are able to connect to each other. Let the magic happen! http://t.co/ulxqkP2h1O"
Saarang- IIT Madras,551998773950681088,2015-01-05 07:08:58+00:00,1,0,For further details check: http://t.co/A996umUwEY$ #NextBigBang #Saarang2015
Saarang- IIT Madras,551998669659324417,2015-01-05 07:08:33+00:00,1,0,"$treet$ is the biggest B-boying competitions to happen in India.Prize money worth 90,000 INR to be won! http://t.co/L01vX49hlR"
Saarang- IIT Madras,551997993243906048,2015-01-05 07:05:51+00:00,3,0,Feel the beat! Get ready for a thumping performance! Don't miss the beatboxing performance by Sudhir.R at Saarang. http://t.co/ibDcyX7vBi
Saarang- IIT Madras,551997405236056067,2015-01-05 07:03:31+00:00,2,2,"Saarang 2015, brings you the versatile, the stunning, the one and only Sunidhi @SunidhiChauhan5 #Saarang2015 http://t.co/kxaBzzoldC"
Saarang- IIT Madras,551031585177231360,2015-01-02 15:05:42+00:00,2,0,Kids had Fun @INOXLEISURE Witness more fun @Saarang_IITM  #SaarangatINOX #NextBigBang http://t.co/JBNWK37GQ2
Saarang- IIT Madras,551030906614329345,2015-01-02 15:03:00+00:00,3,1,I will kill with my cuteness..not hammer Fun @INOXLEISURE Witness more fun @Saarang_IITM  #SaarangatINOX #NextBigBang http://t.co/tOwSgs6KAr
Saarang- IIT Madras,551030199702130689,2015-01-02 15:00:11+00:00,1,1,Lets go to Saarang ! haaha Sure.. Fun @INOXLEISURE Witness more fun @Saarang_IITM  #SaarangatINOX #NextBigBang http://t.co/Nnp7q4oWpA
Saarang- IIT Madras,551029085011734529,2015-01-02 14:55:46+00:00,1,0,Pirates are awesome Noo Cowboys are cool Fun @INOXLEISURE Witness more fun @Saarang_IITM  #SaarangatINOX #NextBigBang http://t.co/XnMkF5fwH6
Saarang- IIT Madras,551028450618650626,2015-01-02 14:53:14+00:00,2,0,Clowns are funny except this one ! Fun @INOXLEISURE Witness more fun @Saarang_IITM  #SaarangatINOX #NextBigBang http://t.co/cZ1trggufJ
Saarang- IIT Madras,551028167788355585,2015-01-02 14:52:07+00:00,1,0,I like to play the Air-guitar ! Fun @INOXLEISURE Witness more fun @Saarang_IITM  #SaarangatINOX #NextBigBang http://t.co/I7aFTQPtOz
Saarang- IIT Madras,551027533999661057,2015-01-02 14:49:36+00:00,2,0,I am the Mirana ! Hi ! Fun @INOXLEISURE Witness more fun @Saarang_IITM  #SaarangatINOX #NextBigBang http://t.co/JSDWtNMSwf
Saarang- IIT Madras,551026794036346880,2015-01-02 14:46:39+00:00,1,0,Do you believe in aliens ? ? Fun @INOXLEISURE Witness more fun @Saarang_IITM  #SaarangatINOX #NextBigBang http://t.co/HNND5esG3p
Saarang- IIT Madras,551025949072818176,2015-01-02 14:43:18+00:00,0,0,I am the Micky-Thor ! Fun @INOXLEISURE Witness more fun @Saarang_IITM  #SaarangatINOX #NextBigBang http://t.co/4dkuD41yrL
Saarang- IIT Madras,551025314952785922,2015-01-02 14:40:47+00:00,1,0,I always wanted to dressup like a Cowboy !! @INOXLEISURE Witness more fun @Saarang_IITM   #SaarangatINOX #NextBigBang http://t.co/PonI0gmQDL
Saarang- IIT Madras,551024927373922304,2015-01-02 14:39:14+00:00,0,0,NOo kid dont !!  @INOXLEISURE  Witness more fun @Saarang_IITM   #SaarangatINOX  #NextBigBang http://t.co/vo385hUcBa
Saarang- IIT Madras,550652205254983680,2015-01-01 13:58:11+00:00,1,0,You Jelly ? #Saarang2015 @Vh1Supersonic #EDM http://t.co/GVBm55tOE4
Saarang- IIT Madras,550652092960874497,2015-01-01 13:57:44+00:00,1,0,Huh I know all the mixes duh :/ #Saarang2015 @Vh1Supersonic #EDM http://t.co/BDAnNjR1VD
Saarang- IIT Madras,550651895136530432,2015-01-01 13:56:57+00:00,1,0,Stalk-athon ! #Saarang2015 @Vh1Supersonic #EDM http://t.co/AV73lhReeM
Saarang- IIT Madras,550651058570002432,2015-01-01 13:53:37+00:00,3,0,You didn’t see that coming !  #Saarang2015 @Vh1Supersonic #EDM http://t.co/Pv8aMOOKqM
Saarang- IIT Madras,550650275212451840,2015-01-01 13:50:30+00:00,1,0,EDM can break all barriers and sometimes you also see totally new sides to your friends. Every group of friends has these 5 people
Saarang- IIT Madras,550647862791380993,2015-01-01 13:40:55+00:00,0,0,#Nostalgia #Saarang13  Get ready for the big bang this season #Saarang2015 http://t.co/I2aMlomb3v
Saarang- IIT Madras,550645153182908416,2015-01-01 13:30:09+00:00,1,0,#Nostalgic season it was  thank you @OrkeStarTrioSG  ! witness #Saarang2015 for beyond #NextBigBang http://t.co/BrU2Xv1T9Y
Saarang- IIT Madras,550637196269469696,2015-01-01 12:58:32+00:00,1,0,"Saarang Sudoku Competition ,BrainBuxa Event Zone http://t.co/q1ZkVDtbhA"
Saarang- IIT Madras,550636255260573696,2015-01-01 12:54:48+00:00,1,0,7 more days to go for the #nextbigbang! #Saarang2015 http://t.co/RGtncqYRkm
Saarang- IIT Madras,550636081981296643,2015-01-01 12:54:06+00:00,0,0,Excited about the new year?  There is more in store for you than you think! Come to the biggest cultural party of year to witness it .
Saarang- IIT Madras,550635825197641728,2015-01-01 12:53:05+00:00,1,0,Do not miss this chance visit http://t.co/NcZktgKnsB for more details. #Saarang2015 #Young_Reporter http://t.co/uMva6byPDK
Saarang- IIT Madras,550635333910425600,2015-01-01 12:51:08+00:00,0,0,"Known for his innovation and creativity at NDTV and then NDTV Hindu, we bring you Sanjay Pinto as judge for ""Young Reporters"" #Saarang2015"
Saarang- IIT Madras,550635067282710528,2015-01-01 12:50:05+00:00,0,0,Bringing back good and clean reporting is Young Reporters! Don't miss the opportunity at Saarang 2015...#Saarang2015
Saarang- IIT Madras,550634601786273792,2015-01-01 12:48:14+00:00,1,0,Think you can sizzle up the screen with your news reporting? Looking for a chance to exercise your Silvertongues? Here is your chance.
Saarang- IIT Madras,550634245282992128,2015-01-01 12:46:49+00:00,1,0,Get the app today from https://t.co/SA66jX6fOr to witness an amazing interface. #Saarang2015
Saarang- IIT Madras,550633940264828930,2015-01-01 12:45:36+00:00,2,1,The Saarang android app is here. Go get it on Google Play Store for an out of the world experience. #Saarang2015 http://t.co/sNQKupkiCI
Saarang- IIT Madras,550159119479762944,2014-12-31 05:18:50+00:00,0,0,Follow the above link for rules and to submit photos. #Saarang2015
Saarang- IIT Madras,550158985954070528,2014-12-31 05:18:18+00:00,1,0,"The competition is being judged by Venky, Photriya Photography and Karthik Srinivasan-Celebrity Photographer. http://t.co/3GMQsLajF4"
Saarang- IIT Madras,550158702876327937,2014-12-31 05:17:10+00:00,0,0,"The deadline for the Online Photography Contest is here. Submit your entries on the link by 10:00 pm, 4/1/15. http://t.co/LXIKZreHV5"
Saarang- IIT Madras,550158085944520705,2014-12-31 05:14:43+00:00,0,0,"Saarang, IIT Madras presents to you Freestyle Solo. Come and unleash your inner dancer! #Saarang2015"
Saarang- IIT Madras,550157975118442496,2014-12-31 05:14:17+00:00,1,0,"Are you free spirited and do not like restrictions when it comes to dance? Well, this is the event to watch out for! http://t.co/sDk1HgKErJ"
Saarang- IIT Madras,550157347046584321,2014-12-31 05:11:47+00:00,0,0,Do you think you have it in you to dazzle the world with your talent and style? It's your opportunity to stand out of the crowd at Saarang.
Saarang- IIT Madras,550157276896837632,2014-12-31 05:11:30+00:00,1,0,"We bring to you Mr and Ms Saarang, calling out to all the fashionistas and studs Saarang, IIT Madras. #Saarang2015 http://t.co/8wx7gCgPny"
Saarang- IIT Madras,550156597587349505,2014-12-31 05:08:48+00:00,1,0,"This time, Saarang, IIT Madras brings forth, the Indian film sound designer, editor and mixer, Resul Pookutty. http://t.co/ApdvZqn1FX"
Saarang- IIT Madras,549082629421551616,2014-12-28 06:01:14+00:00,2,2,"‘The world speaks to me in colours, my soul answers in music’ - Bombay Jayashri #Saarang2015 http://t.co/RsRnvLuHOP"
Saarang- IIT Madras,549082389838700544,2014-12-28 06:00:17+00:00,0,0,"If words may fail,we hail with great pride,the legendary Indian Carnatic musician,Bombay Jayashri,to cast her charm over the spirit of IITM."
Saarang- IIT Madras,549080070216634369,2014-12-28 05:51:04+00:00,1,0,"For details, visit Saarang Online Creative Writing guidelines on 'How To Participate' http://t.co/41QLsTKWAX Good Luck! #Saarang2015"
Saarang- IIT Madras,549078976690266112,2014-12-28 05:46:44+00:00,2,1,The Second Word War Goes More worthy now. #Saarang2015 http://t.co/xn005L95GK
Saarang- IIT Madras,549078265600540673,2014-12-28 05:43:54+00:00,0,0,"In it's fifth edition, Streets 2015, scheduled to be on 9th January 2015, 10am to 3:30pm, invites you to enjoy the thrill of street dance."
Saarang- IIT Madras,549076071073587200,2014-12-28 05:35:11+00:00,1,0,"The crowd sit with racing hearts.Energy,excitement and glory rule the stage and all around it.This is Saarang Streets http://t.co/t04G7TLAoN"
Saarang- IIT Madras,549075357249191936,2014-12-28 05:32:21+00:00,0,0,The shortlisted bands are requested to send a confirmation email to lm@saarang.org. We look forward to seeing you perform at Saarang!
Saarang- IIT Madras,549075208032636929,2014-12-28 05:31:45+00:00,0,0,Wait List - Sruthilaya Riyaz Mike Settu Congrats to the shortlisted bands for making it through! #Saarang2015
Saarang- IIT Madras,549074065567145984,2014-12-28 05:27:13+00:00,3,1,The Big Band Theory Thillana - NITK Pineapple Express Unison Crescendo Stotra Pitch Blend Enigma LiveWire The Forte WeDesi and....
Saarang- IIT Madras,549073949221335040,2014-12-28 05:26:45+00:00,0,0,Here's the list of shortlisted bands for the Tarang prelims that will take place during Saarang: Aathma The Pappu Project 120 Decibels .....
Saarang- IIT Madras,549072898413953024,2014-12-28 05:22:34+00:00,1,1,"Keep an eye out for 11th January 2015, it’s wonder all over. #Saarang2015 http://t.co/2EDAeCMFEL"
Saarang- IIT Madras,547978935904894978,2014-12-25 04:55:33+00:00,0,0,#TheLunchBox was premiered at the Cannes Critics Week section in 2013. Congratulations @riteshbatra ! #Saarang #LecturesandDemonstrations
Saarang- IIT Madras,547973055419412481,2014-12-25 04:32:11+00:00,0,0,"Behind the sleek, nuanced script of the gilded screen, lies the toil of several men.Saarang unfolds its carpets for one such talented artist"
Saarang- IIT Madras,547762217416814594,2014-12-24 14:34:24+00:00,0,0,"All Photography enthu people put your crazy ideas picturized. Prizes worth INR 50,000 at stake. #saarang #OnlinePhototgraphyContest"
Saarang- IIT Madras,547761416740937728,2014-12-24 14:31:13+00:00,0,0,The wait is over!! The much awaited #OnlinePhotographyContest is here. It’s time to bring out the photographer inside you. #Saarang #OPC
Saarang- IIT Madras,547761073084854274,2014-12-24 14:29:51+00:00,0,1,No theme or camera restriction.3 entries are allowed per participant. submit your entries here http://t.co/9TTefaLF2M http://t.co/1J7gLoTneP
Saarang- IIT Madras,547432012697464833,2014-12-23 16:42:17+00:00,1,2,"Saarang, IIT Madras 2015 presents to you 'the classical arts events'. Come, Perform, Impress and Win... #Saarang2015 http://t.co/7kSdmM414m"
Saarang- IIT Madras,547431658144555008,2014-12-23 16:40:52+00:00,0,0,Here's a platform where all your 'Sadhanas' and 'Riyaz' will bear fruit and bring you glory.
Saarang- IIT Madras,547431576242380800,2014-12-23 16:40:33+00:00,0,0,Looking for a place to prove your mastery over the glorious classical arts of India?
Saarang- IIT Madras,547431374072729602,2014-12-23 16:39:45+00:00,0,2,India's most competitive quizzes await you over 4 days and nights. The Saarang Inquizition has landed!! #Saarang2015 http://t.co/Vb1BUzrNZW
Saarang- IIT Madras,546370504337006592,2014-12-20 18:24:13+00:00,0,0,Don't miss the chance to get your heart racing to this adrenaline pumping action! #Saarang2015 http://t.co/1tSfkXYK2w
Saarang- IIT Madras,546370308622389249,2014-12-20 18:23:27+00:00,0,0,"Saarang 2015 presents Team 8e, a professional BMX stunt performers and team, ready to showcase their jaw dropping crazy skills and stunts."
Saarang- IIT Madras,546369682618343424,2014-12-20 18:20:58+00:00,0,0,"This time, we bring before you Anita Nair, one of the most crafty contemporary Indian writers in English.#Saarang2015 http://t.co/Q2ZafV333g"
Saarang- IIT Madras,546369013039644672,2014-12-20 18:18:18+00:00,0,0,#Saarang2015 http://t.co/bEwmhQo4IF
Saarang- IIT Madras,546368864800346112,2014-12-20 18:17:43+00:00,0,0,"Thump! Vroom! Roar! Login to http://t.co/LrgKCHmhfd, create your #MRFNVMix and you could take a ride on your very own Honda CBR 250R!"
Saarang- IIT Madras,546367474061418496,2014-12-20 18:12:11+00:00,0,0,"It's not the box or the bottle that does the work, it's the hands and the mind using the colour that is key -Rick Wellman. #Saarang2015"
Saarang- IIT Madras,546367320671535104,2014-12-20 18:11:34+00:00,0,0,Saarang Fine Arts is back with six awesome events which will challenge your creativity and push out your horizons! http://t.co/7pt8Y5Lkev
Saarang- IIT Madras,546366917745709056,2014-12-20 18:09:58+00:00,0,0,Listed below are the bands that have been put on the waiting list :  Binary Dogs Avernus Illusion Diffusion Team Rocket #Saarang2015
Saarang- IIT Madras,546366795892797441,2014-12-20 18:09:29+00:00,0,0,The Rubberband The Second Chance Pizza Planet 9 Days All the Idlies Mount &amp; Do Buried Remnants The Nerds #Saarang2015
Saarang- IIT Madras,546366625251749888,2014-12-20 18:08:49+00:00,0,0,Deaf Note Beyond Blood Distortion Dark Prophecy MK-Jam Fatal Conspiracy Debarred Rock Paper Scissor The Acoustic Bastards and.. #Saarang2015
Saarang- IIT Madras,546366423539265536,2014-12-20 18:08:01+00:00,0,0,The bands selected are: D's Kitchen Trash Talk Ominous TheStompShire Above Anguish SpineShatter Waterlemons Vertigo and....... #Saarang2015
Saarang- IIT Madras,546365888736133120,2014-12-20 18:05:53+00:00,0,0,"The list of bands selected for the preliminary round of Powerchords is out! Watch these bands rock the stage at Saarang, on the 8th of Jan!"
